{
  "$schema": "https://example.local/schemas/bible-anagrams.schema.json",
  "game": "bible-anagrams",
  "version": 1,
  "displayName": "Bible Anagrams",
  "roundsPerSession": 10,
  "sessions": [
    {
      "id": "ba-session-01",
      "title": "Bible Anagrams Deck 1",
      "theme": "Bible names, places, things, and events",
      "rounds": [
        {
          "id": "ba-r001-moses",
          "answer": "Moses",
          "category": "Person",
          "clue": "He led Israel out of Egypt.",
          "theme": "Exodus",
          "difficulty": "easy",
          "teachingNote": "Moses is the person identified by the clue \"He led Israel out of Egypt.\" Review Exodus for the biblical setting behind that answer."
        },
        {
          "id": "ba-r002-noah",
          "answer": "Noah",
          "category": "Person",
          "clue": "He built an ark before the flood.",
          "theme": "Genesis",
          "difficulty": "easy",
          "teachingNote": "Noah is the person identified by the clue \"He built an ark before the flood.\" Review Genesis for the biblical setting behind that answer."
        },
        {
          "id": "ba-r003-david",
          "answer": "David",
          "category": "Person",
          "clue": "He defeated Goliath with a sling.",
          "theme": "1-2 Samuel",
          "difficulty": "easy",
          "teachingNote": "David is the person identified by the clue \"He defeated Goliath with a sling.\" Review 1-2 Samuel for the biblical setting behind that answer."
        },
        {
          "id": "ba-r004-solomon",
          "answer": "Solomon",
          "category": "Person",
          "clue": "He asked God for wisdom and became a wise king.",
          "theme": "1 Kings",
          "difficulty": "easy",
          "teachingNote": "Solomon is the person identified by the clue \"He asked God for wisdom and became a wise king.\" Review 1 Kings for the biblical setting behind that answer."
        },
        {
          "id": "ba-r005-abraham",
          "answer": "Abraham",
          "category": "Person",
          "clue": "God promised to make him the father of many nations.",
          "theme": "Genesis",
          "difficulty": "medium",
          "teachingNote": "Abraham is the person identified by the clue \"God promised to make him the father of many nations.\" Review Genesis for the biblical setting behind that answer."
        },
        {
          "id": "ba-r006-joseph",
          "answer": "Joseph",
          "category": "Person",
          "clue": "His brothers sold him into slavery in Egypt.",
          "theme": "Genesis",
          "difficulty": "easy",
          "teachingNote": "Joseph is the person identified by the clue \"His brothers sold him into slavery in Egypt.\" Review Genesis for the biblical setting behind that answer."
        },
        {
          "id": "ba-r007-daniel",
          "answer": "Daniel",
          "category": "Person",
          "clue": "He survived a night in a den of lions.",
          "theme": "Daniel",
          "difficulty": "easy",
          "teachingNote": "Daniel is the person identified by the clue \"He survived a night in a den of lions.\" Review Daniel for the biblical setting behind that answer."
        },
        {
          "id": "ba-r008-jonah",
          "answer": "Jonah",
          "category": "Person",
          "clue": "A great fish swallowed him for three days.",
          "theme": "Jonah",
          "difficulty": "easy",
          "teachingNote": "Jonah is the person identified by the clue \"A great fish swallowed him for three days.\" Review Jonah for the biblical setting behind that answer."
        },
        {
          "id": "ba-r009-samson",
          "answer": "Samson",
          "category": "Person",
          "clue": "His strength was tied to his uncut hair.",
          "theme": "Judges",
          "difficulty": "medium",
          "teachingNote": "Samson is the person identified by the clue \"His strength was tied to his uncut hair.\" Review Judges for the biblical setting behind that answer."
        },
        {
          "id": "ba-r010-elijah",
          "answer": "Elijah",
          "category": "Person",
          "clue": "He faced the prophets of Baal on Mount Carmel.",
          "theme": "1 Kings",
          "difficulty": "medium",
          "teachingNote": "Elijah is the person identified by the clue \"He faced the prophets of Baal on Mount Carmel.\" Review 1 Kings for the biblical setting behind that answer."
        }
      ]
    },
    {
      "id": "ba-session-02",
      "title": "Bible Anagrams Deck 2",
      "theme": "Bible names, places, things, and events",
      "rounds": [
        {
          "id": "ba-r011-elisha",
          "answer": "Elisha",
          "category": "Person",
          "clue": "He received a double portion of his mentor's spirit.",
          "theme": "2 Kings",
          "difficulty": "hard",
          "teachingNote": "Elisha is the person identified by the clue \"He received a double portion of his mentor's spirit.\" Review 2 Kings for the biblical setting behind that answer."
        },
        {
          "id": "ba-r012-isaiah",
          "answer": "Isaiah",
          "category": "Person",
          "clue": "A major prophet who foretold a coming Messiah.",
          "theme": "Isaiah",
          "difficulty": "medium",
          "teachingNote": "Isaiah is the person identified by the clue \"A major prophet who foretold a coming Messiah.\" Review Isaiah for the biblical setting behind that answer."
        },
        {
          "id": "ba-r013-jeremiah",
          "answer": "Jeremiah",
          "category": "Person",
          "clue": "Known as the weeping prophet.",
          "theme": "Jeremiah",
          "difficulty": "medium",
          "teachingNote": "Jeremiah is the person identified by the clue \"Known as the weeping prophet.\" Review Jeremiah for the biblical setting behind that answer."
        },
        {
          "id": "ba-r014-ezekiel",
          "answer": "Ezekiel",
          "category": "Person",
          "clue": "He saw a vision of a valley of dry bones.",
          "theme": "Ezekiel",
          "difficulty": "hard",
          "teachingNote": "Ezekiel is the person identified by the clue \"He saw a vision of a valley of dry bones.\" Review Ezekiel for the biblical setting behind that answer."
        },
        {
          "id": "ba-r015-ruth",
          "answer": "Ruth",
          "category": "Person",
          "clue": "A Moabite woman loyal to her mother-in-law Naomi.",
          "theme": "Ruth",
          "difficulty": "easy",
          "teachingNote": "Ruth is the person identified by the clue \"A Moabite woman loyal to her mother-in-law Naomi.\" Review Ruth for the biblical setting behind that answer."
        },
        {
          "id": "ba-r016-esther",
          "answer": "Esther",
          "category": "Person",
          "clue": "A queen who risked her life to save her people.",
          "theme": "Esther",
          "difficulty": "easy",
          "teachingNote": "Esther is the person identified by the clue \"A queen who risked her life to save her people.\" Review Esther for the biblical setting behind that answer."
        },
        {
          "id": "ba-r017-deborah",
          "answer": "Deborah",
          "category": "Person",
          "clue": "A judge and prophetess who led Israel to victory.",
          "theme": "Judges",
          "difficulty": "medium",
          "teachingNote": "Deborah is the person identified by the clue \"A judge and prophetess who led Israel to victory.\" Review Judges for the biblical setting behind that answer."
        },
        {
          "id": "ba-r018-gideon",
          "answer": "Gideon",
          "category": "Person",
          "clue": "He defeated a large army with only three hundred men.",
          "theme": "Judges",
          "difficulty": "medium",
          "teachingNote": "Gideon is the person identified by the clue \"He defeated a large army with only three hundred men.\" Review Judges for the biblical setting behind that answer."
        },
        {
          "id": "ba-r019-joshua",
          "answer": "Joshua",
          "category": "Person",
          "clue": "He led Israel into the Promised Land after Moses.",
          "theme": "Joshua",
          "difficulty": "easy",
          "teachingNote": "Joshua is the person identified by the clue \"He led Israel into the Promised Land after Moses.\" Review Joshua for the biblical setting behind that answer."
        },
        {
          "id": "ba-r020-samuel",
          "answer": "Samuel",
          "category": "Person",
          "clue": "He anointed both Saul and David as king.",
          "theme": "1 Samuel",
          "difficulty": "medium",
          "teachingNote": "Samuel is the person identified by the clue \"He anointed both Saul and David as king.\" Review 1 Samuel for the biblical setting behind that answer."
        }
      ]
    },
    {
      "id": "ba-session-03",
      "title": "Bible Anagrams Deck 3",
      "theme": "Bible names, places, things, and events",
      "rounds": [
        {
          "id": "ba-r021-saul",
          "answer": "Saul",
          "category": "Person",
          "clue": "Israel's first king.",
          "theme": "1 Samuel",
          "difficulty": "easy",
          "teachingNote": "Saul is the person identified by the clue \"Israel's first king.\" Review 1 Samuel for the biblical setting behind that answer."
        },
        {
          "id": "ba-r022-jacob",
          "answer": "Jacob",
          "category": "Person",
          "clue": "He wrestled with an angel and was renamed Israel.",
          "theme": "Genesis",
          "difficulty": "easy",
          "teachingNote": "Jacob is the person identified by the clue \"He wrestled with an angel and was renamed Israel.\" Review Genesis for the biblical setting behind that answer."
        },
        {
          "id": "ba-r023-isaac",